<?xml version="1.0" encoding ="UTF-8"?>
<users xmlns:xsi="http://www.w3.org/2001/XMLSchema-instance"
         xsi:schemaLocation="http://by.it.govor/XML XML.xsd"
         xmlns="http://by.it.govor/XML"
>
    <user>
        <name>Govor Eugene </name>
        <nick> ...</nick>
        <telephone>+375447771060</telephone>
        <adres>
            <country>Belarus</country>
            <city>Minsk</city>
        </adres>
        <ads>
            <ad>
                <processor> Ryzen 5 1600</processor>
                <video_card> NVIDIA GeForce GTX 1060</video_card>
                <motherboard>B350</motherboard>
                <ram> 16Gb 3.2</ram>
                <power_supply> ... 5000W</power_supply>
                <HDD>...</HDD>
            </ad>
        </ads>
    </user>
    </users>